{
  "schema_version": "0.1",
  "id": "10000000-0000-4000-8000-000000000001",
  "version": 1,
  "speaker_id": "10000000-0000-4000-8000-000000000002",
  "consent_id": "10000000-0000-4000-8000-000000000003",
  "language": "som",
  "dialect": "Unspecified",
  "dialect_source": "unspecified",
  "audio_path": "audio/synthetic-no-media.wav",
  "sha256": "0000000000000000000000000000000000000000000000000000000000000000",
  "duration_seconds": 5,
  "sample_rate_hz": 16000,
  "channels": 1,
  "encoding": "PCM_S16LE",
  "transcript_verbatim": "SYNTHETIC FIXTURE — not Somali language data",
  "transcript_normalized": "synthetic fixture not somali language data",
  "normalization_version": "draft-0.1",
  "prompt_id": null,
  "source": "Invented metadata example; no audio file or participant exists.",
  "license": "Permission pending",
  "rights_status": "pending",
  "release_scope": "internal",
  "permitted_uses": [
    "evaluation"
  ],
  "split": "unassigned",
  "status": "draft",
  "contributor_id": "10000000-0000-4000-8000-000000000004",
  "reviewer_id": null,
  "synthetic": true,
  "created_at": "2026-10-25T12:00:00Z",
  "updated_at": "2026-10-25T12:00:00Z"
}
